id;api_area;endpoint;error_code;problem;root_cause;solution;tags;logs
1;Auth API;POST /auth/token;401;Invalid credentials error when requesting token;Expired or incorrect client_secret;Generate a new client_secret and update configuration;;
2;Orders API;POST /orders;400;customerId field missing error;Incorrect field name used in request body;Use 'customer_id' field name according to API v2 specification;;
3;Payments API;POST /payments;409;Duplicate transaction error;Reused idempotency_key;Generate a new unique idempotency_key for each request;;
4;Webhook API;POST /webhook;403;Webhook endpoint returns forbidden error;IP address not whitelisted;Add sender IP address to the whitelist;;
5;Rate Limit;GET /orders;429;Too many requests error;Exceeded rate limit threshold;Implement retry logic with exponential backoff;;
6;File Upload API;POST /files/upload;413;Payload too large error;File size exceeds allowed limit;Reduce file size or split into smaller parts;;
7;Orders API;GET /orders/{id};404;Order not found error;Incorrect order ID provided;Verify order ID exists in the system;;
8;Payments API;POST /payments/refund;500;Internal server error during refund;Temporary backend service failure;Retry request after a short delay;;
9;Auth API;POST /auth/token;400;Invalid grant type error;Unsupported grant_type parameter;Use supported grant_type according to API documentation;;
10;Webhooks API;POST /webhook;400;Invalid signature error;Incorrect webhook signature validation;Verify secret key and signature generation logic;;
12;Orders API;POST /orders;201;Can not create order with similar parameters ;Can not be created similar order with similar parameters to avoid duplication;Check if current order already exists;;
13;Orders API;GET /orders/{id};201;Invalid order returned;Incorrect order Id or duplicated orders;Check order Id in database;orders-api, invalid-response, error-201, order-id, data-duplication;"log1
log2
log3"
14;Orders API;PUTCH /orders{id};401;Can not update order;Can not update order, order not found;Check if order exists or OrderId exists in database;order;
15;Payments API;GET /Payment/{id};404;Payment not found;Payment not found or invalid Payment Id provided;Check if payment exists in database or correct Payment Id provided;payments-api, 404-error, payment-id, not-found, endpoint-issue;"log1
log2"
